<?xml version="1.0" encoding="UTF-8"?>
<xs:schema xmlns:xs="http://www.w3.org/2001/XMLSchema">

  <xs:element name="organizacion_software">
    <xs:complexType>
      <xs:sequence>
        
        <xs:element name="departamento" maxOccurs="unbounded">
          <xs:complexType>
            <xs:sequence>
              <xs:element name="nombreDepartamento" type="xs:string"/> <xs:element name="sede" type="xs:string"/>
              
              <xs:element name="programadores">
                <xs:complexType>
                  <xs:sequence>
                    <xs:element name="programador" maxOccurs="unbounded">
                      <xs:complexType>
                        <xs:sequence>
                          <xs:element name="nombre" type="xs:string"/>
                          <xs:element name="nivel" type="xs:string"/> <xs:element name="mentor" type="xs:string" minOccurs="0"/> </xs:sequence>
                      </xs:complexType>
                    </xs:element>
                  </xs:sequence>
                </xs:complexType>
              </xs:element>

              <xs:element name="proyectos">
                <xs:complexType>
                  <xs:sequence>
                    <xs:element name="proyecto" maxOccurs="unbounded">
                      <xs:complexType>
                        <xs:sequence>
                          <xs:element name="nombreProyecto" type="xs:string"/>
                          <xs:element name="subproyecto" type="xs:string" minOccurs="0" maxOccurs="unbounded"/>
                        </xs:sequence>
                      </xs:complexType>
                    </xs:element>
                  </xs:sequence>
                </xs:complexType>
              </xs:element>

            </xs:sequence>
          </xs:complexType>
        </xs:element>

      </xs:sequence>
    </xs:complexType>
  </xs:element>

</xs:schema>